{
  "id": "full-regression",
  "description": "Все активные кейсы с тегом regression",
  "include": {
    "case_ids": [],
    "products": [],
    "sections": [],
    "tags": ["regression"],
    "statuses": []
  },
  "exclude": {
    "case_ids": [],
    "products": [],
    "sections": [],
    "tags": [],
    "statuses": ["deprecated"]
  }
}
